{
  "$schema": "https://json-schema.org/draft/2020-12/schema",
  "$id": "https://stemmio.local/schemas/candidate-assessment.v1.schema.json",
  "title": "Stemmio AI candidate assessment v1",
  "description": "A coarse candidate health and document-continuity assessment. Comment targets remain review guidance and are not an acceptance boundary.",
  "type": "object",
  "additionalProperties": false,
  "required": [
    "schemaVersion",
    "status",
    "projectId",
    "documentId",
    "requestId",
    "attemptId",
    "candidateVersionId",
    "baseSha256",
    "outputSha256",
    "baseComparisonSha256",
    "outputComparisonSha256",
    "issueCodes",
    "health",
    "continuity",
    "assessedAt"
  ],
  "allOf": [
    {
      "if": {
        "anyOf": [
          { "required": ["changedElementCount"] },
          { "required": ["outsideTargetCount"] },
          { "required": ["changedElementIdSample"] },
          { "required": ["outsideTargetElementIdSample"] },
          { "required": ["truncated"] },
          { "required": ["requestedTargetCount"] }
        ]
      },
      "then": {
        "required": [
          "changedElementCount",
          "requestedTargetCount",
          "outsideTargetCount",
          "changedElementIdSample",
          "outsideTargetElementIdSample",
          "truncated"
        ]
      }
    }
  ],
  "properties": {
    "schemaVersion": {
      "const": "1.0.0"
    },
    "status": {
      "enum": ["ready", "attention", "blocked"]
    },
    "projectId": {
      "type": "string",
      "pattern": "^project_[A-Za-z0-9_-]+$"
    },
    "documentId": {
      "type": "string",
      "pattern": "^doc_[A-Za-z0-9_-]+$"
    },
    "requestId": {
      "type": "string",
      "pattern": "^req_[A-Za-z0-9_-]+$"
    },
    "attemptId": {
      "type": "string",
      "pattern": "^attempt_[0-9]{3}$"
    },
    "candidateVersionId": {
      "type": "string",
      "pattern": "^ver_[0-9]{4,}$"
    },
    "baseSha256": {
      "$ref": "#/$defs/sha256"
    },
    "outputSha256": {
      "$ref": "#/$defs/sha256"
    },
    "baseComparisonSha256": {
      "$ref": "#/$defs/sha256"
    },
    "outputComparisonSha256": {
      "$ref": "#/$defs/sha256"
    },
    "issueCodes": {
      "type": "array",
      "uniqueItems": true,
      "maxItems": 10,
      "items": {
        "type": "string",
        "minLength": 1,
        "maxLength": 120
      }
    },
    "health": {
      "type": "object",
      "additionalProperties": false,
      "required": ["completeDocument", "bodyHasContent"],
      "properties": {
        "completeDocument": { "type": "boolean" },
        "bodyHasContent": { "type": "boolean" }
      }
    },
    "continuity": {
      "type": "object",
      "additionalProperties": false,
      "required": [
        "status",
        "evidencePoints",
        "sameTitle",
        "text",
        "anchors",
        "classes",
        "assets",
        "baseVisibleTextLength",
        "outputVisibleTextLength",
        "baseBodyElementCount",
        "outputBodyElementCount",
        "baseParseErrorCount",
        "outputParseErrorCount"
      ],
      "properties": {
        "status": { "enum": ["related", "uncertain"] },
        "evidencePoints": { "type": "integer", "minimum": 0 },
        "sameTitle": { "type": "boolean" },
        "text": { "$ref": "#/$defs/overlap" },
        "anchors": { "$ref": "#/$defs/overlap" },
        "classes": { "$ref": "#/$defs/overlap" },
        "assets": { "$ref": "#/$defs/overlap" },
        "baseVisibleTextLength": { "type": "integer", "minimum": 0 },
        "outputVisibleTextLength": { "type": "integer", "minimum": 0 },
        "baseBodyElementCount": { "type": "integer", "minimum": 0 },
        "outputBodyElementCount": { "type": "integer", "minimum": 0 },
        "baseParseErrorCount": { "type": "integer", "minimum": 0 },
        "outputParseErrorCount": { "type": "integer", "minimum": 0 }
      }
    },
    "changedElementCount": {
      "type": "integer",
      "minimum": 0
    },
    "outsideTargetCount": {
      "type": "integer",
      "minimum": 0
    },
    "changedElementIdSample": {
      "type": "array",
      "uniqueItems": true,
      "maxItems": 100,
      "items": { "type": "string", "pattern": "^sm1_[0-9a-f]{12}4[0-9a-f]{3}[89ab][0-9a-f]{15}$" }
    },
    "outsideTargetElementIdSample": {
      "type": "array",
      "uniqueItems": true,
      "maxItems": 100,
      "items": { "type": "string", "pattern": "^sm1_[0-9a-f]{12}4[0-9a-f]{3}[89ab][0-9a-f]{15}$" }
    },
    "truncated": {
      "type": "boolean"
    },
    "requestedTargetCount": {
      "type": "integer",
      "minimum": 0
    },
    "assessedAt": {
      "type": "string",
      "format": "date-time"
    }
  },
  "$defs": {
    "sha256": {
      "type": "string",
      "pattern": "^sha256:[a-f0-9]{64}$"
    },
    "overlap": {
      "type": "object",
      "additionalProperties": false,
      "required": ["score", "shared", "base", "output"],
      "properties": {
        "score": {
          "oneOf": [
            { "type": "number", "minimum": 0, "maximum": 1 },
            { "type": "null" }
          ]
        },
        "shared": { "type": "integer", "minimum": 0 },
        "base": { "type": "integer", "minimum": 0 },
        "output": { "type": "integer", "minimum": 0 }
      }
    }
  }
}
